{
  "schema_version": "1.0.0",
  "id": "ai_so3_pool_dedup_20260607t211540_1",
  "kind": "artifact_instance",
  "artifact_type": "ia-cloud",
  "cardinality": "one",
  "produced_by": {
    "run": "pr_so3_pool_dedup_20260607t211540",
    "step": "dedup"
  },
  "port": "q0_canon",
  "path": "research_os/artifact_instances/data/ai_so3_pool_dedup_20260607t211540_1.npz",
  "cardinality_n": null,
  "size_bytes": 61370,
  "sample": {
    "shape": [
      2000,
      4
    ],
    "dtype": "float64"
  },
  "caption": "ia-cloud . from dedup",
  "commit": "70b620a",
  "created_at": "2026-06-07T21:15:40"
}
